{
  "suite_id": "forgeops-replay-contract-v1",
  "suite_version": "1.0",
  "schema_ref": "contracts/forgeops-replay-contract/1.0/schema.json",
  "cases": [
    {"id": "POSITIVE_AUDIT_READ_ONLY", "kind": "positive", "request": {"mode": "AUDIT_REPLAY", "lineage": {"source_task_id": "TASK-1", "source_run_id": "RUN-1", "source_manifest_id": "MANIFEST-1", "source_correlation_id": "CORR-1", "source_event_seq": 7}, "new_identity": {"task_id": "TASK-1", "run_id": "RUN-2", "correlation_id": "CORR-2", "event_seq": 8}, "contract_changed": false, "copied_controls": [], "requested_external_effect": false, "outcome_known": true, "reexecute_preconditions": {"remote_state_observed": false, "fresh_effect_candidate": false, "current_revision": false, "fresh_approval": false, "fresh_nonce": false, "fresh_evidence": false, "exact_authority": false, "capability_available": false}}, "expected_result": "PASSED"},
    {"id": "POSITIVE_COUNTERFACTUAL_EFFECT_FREE", "kind": "positive", "request": {"mode": "COUNTERFACTUAL", "lineage": {"source_task_id": "TASK-2", "source_run_id": "RUN-2", "source_manifest_id": "MANIFEST-2", "source_correlation_id": "CORR-2", "source_event_seq": 11}, "new_identity": {"task_id": "TASK-3", "run_id": "RUN-3", "correlation_id": "CORR-3", "event_seq": 12}, "contract_changed": true, "copied_controls": [], "requested_external_effect": false, "outcome_known": true, "reexecute_preconditions": {"remote_state_observed": false, "fresh_effect_candidate": false, "current_revision": false, "fresh_approval": false, "fresh_nonce": false, "fresh_evidence": false, "exact_authority": false, "capability_available": false}}, "expected_result": "PASSED"},
    {"id": "POSITIVE_REEXECUTE_EFFECT_FREE", "kind": "positive", "request": {"mode": "REEXECUTE", "lineage": {"source_task_id": "TASK-4", "source_run_id": "RUN-4", "source_manifest_id": "MANIFEST-4", "source_correlation_id": "CORR-4", "source_event_seq": 13}, "new_identity": {"task_id": "TASK-4", "run_id": "RUN-5", "correlation_id": "CORR-5", "event_seq": 14}, "contract_changed": false, "copied_controls": [], "requested_external_effect": false, "outcome_known": true, "reexecute_preconditions": {"remote_state_observed": true, "fresh_effect_candidate": true, "current_revision": true, "fresh_approval": true, "fresh_nonce": true, "fresh_evidence": true, "exact_authority": true, "capability_available": true}}, "expected_result": "PASSED"},
    {"id": "POSITIVE_REEXECUTE_EXTERNAL_EFFECT", "kind": "positive", "request": {"mode": "REEXECUTE", "lineage": {"source_task_id": "TASK-21", "source_run_id": "RUN-21", "source_manifest_id": "MANIFEST-21", "source_correlation_id": "CORR-21", "source_event_seq": 31}, "new_identity": {"task_id": "TASK-21", "run_id": "RUN-22", "correlation_id": "CORR-22", "event_seq": 32}, "contract_changed": false, "copied_controls": [], "requested_external_effect": true, "outcome_known": true, "reexecute_preconditions": {"remote_state_observed": true, "fresh_effect_candidate": true, "current_revision": true, "fresh_approval": true, "fresh_nonce": true, "fresh_evidence": true, "exact_authority": true, "capability_available": true}}, "expected_result": "PASSED"},
    {"id": "NEGATIVE_INVALID_MODE", "kind": "negative", "request": {"mode": "REPLAY", "lineage": {"source_task_id": "TASK-5", "source_run_id": "RUN-5", "source_manifest_id": "MANIFEST-5", "source_correlation_id": "CORR-5", "source_event_seq": 15}, "new_identity": {"task_id": "TASK-5", "run_id": "RUN-6", "correlation_id": "CORR-6", "event_seq": 16}, "contract_changed": false, "copied_controls": [], "requested_external_effect": false, "outcome_known": true, "reexecute_preconditions": {"remote_state_observed": false, "fresh_effect_candidate": false, "current_revision": false, "fresh_approval": false, "fresh_nonce": false, "fresh_evidence": false, "exact_authority": false, "capability_available": false}}, "expected_error": "REPLAY_MODE_INVALID"},
    {"id": "NEGATIVE_LINEAGE_MISSING", "kind": "negative", "request": {"mode": "AUDIT_REPLAY", "lineage": {"source_task_id": "", "source_run_id": "RUN-6", "source_manifest_id": "MANIFEST-6", "source_correlation_id": "CORR-6", "source_event_seq": 16}, "new_identity": {"task_id": "TASK-6", "run_id": "RUN-7", "correlation_id": "CORR-7", "event_seq": 17}, "contract_changed": false, "copied_controls": [], "requested_external_effect": false, "outcome_known": true, "reexecute_preconditions": {"remote_state_observed": false, "fresh_effect_candidate": false, "current_revision": false, "fresh_approval": false, "fresh_nonce": false, "fresh_evidence": false, "exact_authority": false, "capability_available": false}}, "expected_error": "REPLAY_LINEAGE_MISSING"},
    {"id": "NEGATIVE_RUN_REUSED", "kind": "negative", "request": {"mode": "AUDIT_REPLAY", "lineage": {"source_task_id": "TASK-7", "source_run_id": "RUN-7", "source_manifest_id": "MANIFEST-7", "source_correlation_id": "CORR-7", "source_event_seq": 17}, "new_identity": {"task_id": "TASK-7", "run_id": "RUN-7", "correlation_id": "CORR-8", "event_seq": 18}, "contract_changed": false, "copied_controls": [], "requested_external_effect": false, "outcome_known": true, "reexecute_preconditions": {"remote_state_observed": false, "fresh_effect_candidate": false, "current_revision": false, "fresh_approval": false, "fresh_nonce": false, "fresh_evidence": false, "exact_authority": false, "capability_available": false}}, "expected_error": "REPLAY_IDENTITY_REUSED"},
    {"id": "NEGATIVE_CORRELATION_REUSED", "kind": "negative", "request": {"mode": "AUDIT_REPLAY", "lineage": {"source_task_id": "TASK-8", "source_run_id": "RUN-8", "source_manifest_id": "MANIFEST-8", "source_correlation_id": "CORR-8", "source_event_seq": 18}, "new_identity": {"task_id": "TASK-8", "run_id": "RUN-9", "correlation_id": "CORR-8", "event_seq": 19}, "contract_changed": false, "copied_controls": [], "requested_external_effect": false, "outcome_known": true, "reexecute_preconditions": {"remote_state_observed": false, "fresh_effect_candidate": false, "current_revision": false, "fresh_approval": false, "fresh_nonce": false, "fresh_evidence": false, "exact_authority": false, "capability_available": false}}, "expected_error": "REPLAY_IDENTITY_REUSED"},
    {"id": "NEGATIVE_SEQUENCE_REUSED", "kind": "negative", "request": {"mode": "AUDIT_REPLAY", "lineage": {"source_task_id": "TASK-9", "source_run_id": "RUN-9", "source_manifest_id": "MANIFEST-9", "source_correlation_id": "CORR-9", "source_event_seq": 19}, "new_identity": {"task_id": "TASK-9", "run_id": "RUN-10", "correlation_id": "CORR-10", "event_seq": 19}, "contract_changed": false, "copied_controls": [], "requested_external_effect": false, "outcome_known": true, "reexecute_preconditions": {"remote_state_observed": false, "fresh_effect_candidate": false, "current_revision": false, "fresh_approval": false, "fresh_nonce": false, "fresh_evidence": false, "exact_authority": false, "capability_available": false}}, "expected_error": "REPLAY_IDENTITY_REUSED"},
    {"id": "NEGATIVE_COUNTERFACTUAL_TASK_REUSED", "kind": "negative", "request": {"mode": "COUNTERFACTUAL", "lineage": {"source_task_id": "TASK-10", "source_run_id": "RUN-10", "source_manifest_id": "MANIFEST-10", "source_correlation_id": "CORR-10", "source_event_seq": 20}, "new_identity": {"task_id": "TASK-10", "run_id": "RUN-11", "correlation_id": "CORR-11", "event_seq": 21}, "contract_changed": true, "copied_controls": [], "requested_external_effect": false, "outcome_known": true, "reexecute_preconditions": {"remote_state_observed": false, "fresh_effect_candidate": false, "current_revision": false, "fresh_approval": false, "fresh_nonce": false, "fresh_evidence": false, "exact_authority": false, "capability_available": false}}, "expected_error": "REPLAY_IDENTITY_REUSED"},
    {"id": "NEGATIVE_COPY_AUTHORITY", "kind": "negative", "request": {"mode": "AUDIT_REPLAY", "lineage": {"source_task_id": "TASK-11", "source_run_id": "RUN-11", "source_manifest_id": "MANIFEST-11", "source_correlation_id": "CORR-11", "source_event_seq": 21}, "new_identity": {"task_id": "TASK-11", "run_id": "RUN-12", "correlation_id": "CORR-12", "event_seq": 22}, "contract_changed": false, "copied_controls": ["authority"], "requested_external_effect": false, "outcome_known": true, "reexecute_preconditions": {"remote_state_observed": false, "fresh_effect_candidate": false, "current_revision": false, "fresh_approval": false, "fresh_nonce": false, "fresh_evidence": false, "exact_authority": false, "capability_available": false}}, "expected_error": "REPLAY_CONTROL_COPY_FORBIDDEN"},
    {"id": "NEGATIVE_COPY_APPROVAL_TOKEN", "kind": "negative", "request": {"mode": "AUDIT_REPLAY", "lineage": {"source_task_id": "TASK-12", "source_run_id": "RUN-12", "source_manifest_id": "MANIFEST-12", "source_correlation_id": "CORR-12", "source_event_seq": 22}, "new_identity": {"task_id": "TASK-12", "run_id": "RUN-13", "correlation_id": "CORR-13", "event_seq": 23}, "contract_changed": false, "copied_controls": ["approval_token"], "requested_external_effect": false, "outcome_known": true, "reexecute_preconditions": {"remote_state_observed": false, "fresh_effect_candidate": false, "current_revision": false, "fresh_approval": false, "fresh_nonce": false, "fresh_evidence": false, "exact_authority": false, "capability_available": false}}, "expected_error": "REPLAY_CONTROL_COPY_FORBIDDEN"},